{
  "agent": "icp-reader",
  "task_id": "getting-married-in-italy",
  "stage": "07",
  "status": "complete",
  "round": 2,
  "inputs_used": [
    "content-system/personas/search-visitor.yaml",
    "content/posts/getting-married-in-italy/05-draft-r2.md"
  ],
  "payload": {
    "persona_id": "search_visitor",
    "first_impression": {
      "kept_reading_after_intro": true,
      "reaction": "Okay, this is actually about my search. First line tells me it's two documents, and it's dated October 2026, so I don't have to wonder if it's some 2019 post. The bit about other guides being written for Brits and Americans made me trust it more, because that's exactly what I kept getting on Google. I read the Key Takeaways, then jumped straight to costs, then skimmed the timeline and FAQ."
    },
    "journey": [
      {
        "section": "Intro",
        "quote": "Most guides online are written for British or American couples and talk about a Certificate of No Impediment, which Italy will not accept from you.",
        "reaction": "Yes. That's the exact confusion I had. Tells me this one is actually for Australians.",
        "type": "gained_trust",
        "severity": "positive"
      },
      {
        "section": "Intro",
        "quote": "This is the Australian version, as at October 2026: what to prepare at home, what to sign in Rome or Milan, what happens at the town hall, and where the marriage stands once you are home.",
        "reaction": "Dated, and it tells me what's coming. Is this still true in 2026? It says so. Good.",
        "type": "gained_trust",
        "severity": "positive"
      },
      {
        "section": "Key takeaways",
        "quote": "Australians need two documents to marry in Italy: an Atto Notorio from the Italian consulate for your state, and a Nulla Osta sworn in person at the Australian Embassy in Rome or the Consulate-General in Milan.",
        "reaction": "That's my answer, in the first screen on my phone. If I left now I'd still have got what I came for.",
        "type": "gained_trust",
        "severity": "positive"
      },
      {
        "section": "The two documents: Atto Notorio",
        "quote": "Get it before you leave, from the Italian consulate for the state where you live.",
        "reaction": "Hang on, I'm Australian but I don't live in an Australian state right now. Which consulate do I use then? Melbourne even wants proof of address in Victoria or Tasmania. Not answered.",
        "type": "confused",
        "severity": "medium"
      },
      {
        "section": "Step by step once you arrive in Italy",
        "quote": "Rome's Prefettura legalisation office opens four mornings a week, and some comuni want your declaration three days before the wedding, so allow a working week rather than arriving two days out.",
        "reaction": "This is the kind of practical line I actually need. A working week. I can plan leave around that.",
        "type": "gained_trust",
        "severity": "positive"
      },
      {
        "section": "Your timeline",
        "quote": "The squeeze is in the middle. Both documents expire six months after signing, so a date that moves late can mean signing again.",
        "reaction": "Useful warning. But I still don't know when I should start the whole thing. Twelve months out? Six? The takeaways never say.",
        "type": "confused",
        "severity": "low"
      },
      {
        "section": "What the paperwork costs",
        "quote": "Most official steps carry a fee, and amounts move with exchange rates or annual indexation.",
        "reaction": "Just tell me how much it costs. I came to this section for numbers and there isn't a single one.",
        "type": "lost_trust",
        "severity": "medium"
      },
      {
        "section": "What the paperwork costs",
        "quote": "a consular fee applies, set by each consulate's tariff.",
        "reaction": "Every bullet says 'a fee applies'. I knew that. A rough figure with a date on it would do.",
        "type": "bored",
        "severity": "medium"
      },
      {
        "section": "What the paperwork costs",
        "quote": "Not published: interpreter and translation rates. Your Wedded Advisor costs the full paperwork in AUD for your comune.",
        "reaction": "Feels like the price is being held back so I have to enquire. Maybe that's not the intent, but that's how it reads after five fee-less bullets.",
        "type": "objection",
        "severity": "medium"
      },
      {
        "section": "DFAT apostilles and NAATI translations",
        "quote": "On Sydney's list, two Australians with two certificates and two translations each can need eight apostilles.",
        "reaction": "Eight! Good to know, and it makes the missing per-apostille fee more annoying, because now I want to multiply it.",
        "type": "objection",
        "severity": "low"
      },
      {
        "section": "Is an Italian marriage recognised in Australia?",
        "quote": "You can't register an overseas marriage in Australia. But in most cases, your marriage is legally recognised here.",
        "reaction": "Clear, quoted from the government. That was my next question and the heading matched it.",
        "type": "gained_trust",
        "severity": "positive"
      },
      {
        "section": "FAQ",
        "quote": "No. The Embassy says Certificates of No Impediment are not valid for use in Italy.",
        "reaction": "Short, direct FAQ answers. This is what I'd screenshot.",
        "type": "gained_trust",
        "severity": "positive"
      },
      {
        "section": "Throughout",
        "quote": "Your Wedded Advisor confirms the comune's list in writing.",
        "reaction": "I don't know who Wedded Advisor is yet and it keeps popping up at the end of sections. Once is fine; by the fifth time it feels like a sales nudge.",
        "type": "bored",
        "severity": "low"
      }
    ],
    "unanswered_questions": [
      "Roughly how much does the paperwork cost in total, even as a ballpark in AUD, as at 2026?",
      "What does the Nulla Osta fee or a single DFAT apostille actually cost?",
      "Which Italian consulate do I use if I'm Australian but living overseas (e.g. in Singapore)?",
      "How many months before the wedding should I start the whole process?",
      "How far ahead do Rome and Milan release Nulla Osta appointments?"
    ],
    "turn_offs_found": [
      {
        "quote": "Most official steps carry a fee, and amounts move with exchange rates or annual indexation.",
        "why": "The cost heading matches my question but the section has no numbers. That's the answer being buried, just in a different way."
      },
      {
        "quote": "For getting married in Italy from Australia, the dates that matter are set by the documents.",
        "why": "The timeline is a ten-row, three-column table. On my phone on the train that's a lot of sideways scrolling. Good content, hard to read in that format."
      }
    ],
    "would_share_with": [
      "My partner, specifically the Key Takeaways and FAQ",
      "A friend planning a wedding in Italy who is also Australian"
    ],
    "cta_reaction": {
      "quote": "A Wedded Advisor works in your time zone, quotes in AUD and stays with you from the first document to the last dance.",
      "would_click": "no",
      "why": "Not today. I came for an answer and got most of it, so I'd bookmark the page rather than talk to anyone. 'Quotes in AUD' is nice, but I'd want to see a rough cost on the page before I'd hand over my details. Maybe later when we've picked a date."
    },
    "scores": {
      "relevance_to_me": 5,
      "trust": 4,
      "clarity": 4,
      "brand_feels_premium": 3,
      "likelihood_to_enquire": 2
    },
    "top_3_changes": [
      "Put actual fee figures (or ranges) with an 'as at' date in the costs section, at least for the Nulla Osta, a DFAT apostille and the Atto Notorio, so 'What the paperwork costs' answers the question in its heading.",
      "Add one Key Takeaway on when to start, e.g. how many months before the wedding to begin the documents, since the takeaways cover what and where but not when.",
      "Say what Australians living outside Australia should do about the Atto Notorio, since every option given assumes you live in an Australian state."
    ]
  },
  "self_qa": {
    "checks": [
      {"check": "Every journey point and turn-off has an exact quote from the draft", "pass": true},
      {"check": "Stayed in character as Priya (phone, one question, doesn't know the brand)", "pass": true},
      {"check": "No invented brand facts; gaps listed as unanswered questions", "pass": true},
      {"check": "[[VERIFY]] markers and HTML comments (image slots, fact tags) treated as invisible", "pass": true},
      {"check": "Payload matches 07-icp.schema.json; top_3_changes has at most 3 items", "pass": true}
    ],
    "confidence": 0.8
  },
  "open_questions": [],
  "assumptions": [
    "Priya's card lists Singapore as her location; given her search 'as an australian', she is read as an Australian living overseas, which drives the consulate question.",
    "Persona reads Key Takeaways plus a few sections (costs, timeline, FAQ) rather than the whole post, per decision_behaviour."
  ],
  "next_agent": ["icp-panel-chair"]
}
