{
  "agent": "icp-reader",
  "task_id": "diamond-buying-guide",
  "stage": "07",
  "status": "complete",
  "round": 1,
  "inputs_used": [
    "content-system/personas/search-visitor.yaml",
    "content/posts/diamond-buying-guide/05-draft.md"
  ],
  "payload": {
    "persona_id": "search_visitor",
    "first_impression": {
      "kept_reading_after_intro": true,
      "reaction": "Intro is two short paragraphs and then Key takeaways, so I got an answer before my next stop. The first line made me curious enough to keep going. Not fluff, but no idea who 'we' are yet."
    },
    "journey": [
      {
        "section": "Intro",
        "quote": "Most advice on choosing a diamond is written by someone with a tray of stones to sell you.",
        "reaction": "Okay, that's a decent hook. Makes me think this one won't just push me toward a shop.",
        "type": "gained_trust",
        "severity": "positive"
      },
      {
        "section": "Key takeaways",
        "quote": "For a round brilliant, cut quality has the greatest effect on sparkle, so settle the cut grade before you trade colour, clarity and size against each other.",
        "reaction": "This is the answer I wanted. Cut first, then trade the rest. Got it in about five seconds.",
        "type": "gained_trust",
        "severity": "positive"
      },
      {
        "section": "Key takeaways",
        "quote": "As at October 2026, jewellery bought overseas counts toward the AUD900 general goods duty-free allowance, so declare a ring that takes you over it.",
        "reaction": "Nice that it's dated, but this is Australian customs. I'm not in Australia, so one of only four takeaways is useless to me. I'd rather have seen natural vs lab-grown up here.",
        "type": "objection",
        "severity": "medium"
      },
      {
        "section": "Diamond buying guide: which of the 4Cs matters most?",
        "quote": "Our view is simple. For a round brilliant, put cut first.",
        "reaction": "Heading matches my search, and it answers straight away. Good.",
        "type": "gained_trust",
        "severity": "positive"
      },
      {
        "section": "Magic sizes, explained without prices",
        "quote": "Magic sizes, explained without prices",
        "reaction": "Just tell me roughly what it costs. Nowhere on the page gives me a ballpark. I get why, but that's the thing I actually wanted to know next.",
        "type": "objection",
        "severity": "medium"
      },
      {
        "section": "Checking the report number on the lab's own site",
        "quote": "Type the number in yourself, on the lab's own website, rather than following a link or QR code someone hands you.",
        "reaction": "Didn't know this. Genuinely useful, the kind of tip that makes me bookmark a page.",
        "type": "gained_trust",
        "severity": "positive"
      },
      {
        "section": "Declaring it on return to Australia",
        "quote": "Your Wedded Advisor confirms the current requirements with you before you travel, as these rules can change.",
        "reaction": "My Wedded Advisor? I don't have one. Who is this? Feels like it's talking to an existing customer.",
        "type": "confused",
        "severity": "low"
      },
      {
        "section": "Your diamond shortlist checklist",
        "quote": "Take this into every appointment, at home or overseas.",
        "reaction": "This is the bit I'd screenshot. Shame it's so far down; on my phone I only found it by scrolling hard.",
        "type": "gained_trust",
        "severity": "positive"
      },
      {
        "section": "FAQ",
        "quote": "Yes. Lab-grown diamonds have essentially the same optical, physical and chemical properties as mined diamonds",
        "reaction": "Short, direct answers. This is how the whole page should read on mobile.",
        "type": "gained_trust",
        "severity": "positive"
      }
    ],
    "unanswered_questions": [
      "Roughly how much does a 1 carat diamond cost, natural vs lab-grown? Even a range would help.",
      "Is lab-grown actually cheaper, and by how much?",
      "Who is Wedded Wonderland, and why is a wedding site writing a diamond guide?",
      "Does any of the customs or consumer-law advice apply if I'm not buying in or returning to Australia?"
    ],
    "turn_offs_found": [
      {
        "quote": "As at October 2026, jewellery bought overseas counts toward the AUD900 general goods duty-free allowance, so declare a ring that takes you over it.",
        "why": "Takes a Key takeaways slot with something only Australians returning from overseas need."
      },
      {
        "quote": "Magic sizes, explained without prices",
        "why": "The heading itself tells me my real question (price) won't be answered here."
      }
    ],
    "would_share_with": [
      "My partner, for the report-checking tip and the checklist"
    ],
    "cta_reaction": {
      "quote": "If the proposal or the wedding is heading overseas, talk to a Wedded Concierge about a proposal or wedding abroad.",
      "would_click": "no",
      "why": "I came for diamond info, not wedding planning. Maybe later, but not from this page today. I'd click the 'how much to spend' link before this."
    },
    "scores": {
      "relevance_to_me": 4,
      "trust": 4,
      "clarity": 4,
      "brand_feels_premium": 3,
      "likelihood_to_enquire": 1
    },
    "top_3_changes": [
      "Swap the Australian customs takeaway for one on natural vs lab-grown, and point readers to the 'how much to spend' guide right in Key takeaways.",
      "Add a jump link to the shortlist checklist near the top so phone readers can get to it without scrolling the whole page.",
      "Explain 'Wedded Advisor' in one line the first time it appears, or leave it out of the body; to a newcomer it reads like it's addressed to someone else."
    ]
  },
  "self_qa": {
    "checks": [
      {"check": "Every journey point and turn-off has an exact quote from the draft", "pass": true},
      {"check": "Stayed in character as Priya (phone, from Google, doesn't know the brand)", "pass": true},
      {"check": "No invented brand facts; unknowns listed as unanswered questions", "pass": true},
      {"check": "[[VERIFY]] markers and HTML comments ignored", "pass": true}
    ],
    "confidence": 0.8
  },
  "open_questions": [],
  "assumptions": [
    "Priya is not Australian (persona location Singapore), so Australia-specific sections are read as low relevance."
  ],
  "next_agent": ["icp-panel-chair"]
}
