{
 "agent": "editor",
 "task_id": "getting-married-in-italy",
 "stage": "06",
 "status": "complete",
 "round": 3,
 "inputs_used": [
  "content/posts/getting-married-in-italy/08-final.md",
  "content/posts/getting-married-in-italy/05-draft-r2.md",
  "content/posts/getting-married-in-italy/07-panel.json",
  "content/posts/getting-married-in-italy/03-source-pack.json",
  "content/posts/getting-married-in-italy/02-seo.json",
  "content/posts/getting-married-in-italy/04-images.json",
  "content/posts/getting-married-in-italy/02-research/pages/",
  "content-system/brand/brand-facts.md",
  "content-system/rubrics/editor-rubric.md",
  "content-system/rubrics/compliance-checklist.md",
  "content-system/rubrics/link-rules.md",
  "content-system/rubrics/qa-gates.md",
  "content-system/seo/link-map.csv"
 ],
 "payload": {
  "draft_file": "content/posts/getting-married-in-italy/08-final.md",
  "rubric": {
   "voice": 5,
   "expertise": 5,
   "accuracy": 4,
   "seo_fit": 4,
   "commercial_link": 5,
   "structure": 5,
   "brief_fit": 5
  },
  "average": 4.71,
  "blocking_issues": [
   "Compliance: no line now says the Wedded Advisor confirms current requirements (the general line was cut at the panel's request). Fix in edits[0], folded into the existing cost-section Advisor line so the count stays at 3.",
   "Legal claim wider than its marker: 'Both of you attend the Atto Notorio' (line 139) generalises Sydney's rule (fact_06) and conflicts with fact_10 for couples where only one partner is Australian. Fix in edits[1]."
  ],
  "decision": "revise",
  "edits": [
   {
    "location": "H2 'What the paperwork costs', last paragraph (line 222): 'Not published: interpreter and translation rates. Your Wedded Advisor costs the full paperwork in AUD for your comune.'",
    "issue": "BLOCKING (compliance-checklist, Legal and travel information: 'Wording says the Wedded Advisor confirms current requirements, rather than giving legal advice'). The final copy cut the only general line that did this ('Rules change, so your Wedded Advisor confirms the current requirements for your date and comune.', line 27 of r2), as the panel asked. The three remaining Advisor lines cover only Nulla Osta lead times, venue approval and costs, so the post now reads as standalone legal advice. Fix folds the requirement into an existing Advisor line, so the count stays at 3 as the panel wanted.",
    "fix": "Replace the second sentence with: \"Your Wedded Advisor confirms the current requirements for your comune and costs the full paperwork in AUD.\" (Full paragraph: \"Not published: interpreter and translation rates. Your Wedded Advisor confirms the current requirements for your comune and costs the full paperwork in AUD.\")"
   },
   {
    "location": "H2 'Your timeline, working back from the wedding date', paragraph after 'The squeeze is in the middle' (line 139): 'Some steps are yours alone. Both of you attend the Atto Notorio with your witnesses, and each Australian signs the Nulla Osta in person in Rome or Milan. <!-- fact_06 --> <!-- fact_17 -->'",
    "issue": "BLOCKING (legal claim wider than its fact marker). fact_06 is the Sydney consulate's rule, and the article itself says so earlier ('In Sydney, both of you attend...'). This new sentence makes it universal, and that clashes with fact_10: when only one partner is Australian, the documents are for the Australian partner only.",
    "fix": "Replace with: \"Some steps are yours alone. In Sydney, both of you attend the Atto Notorio with your witnesses, and each Australian signs the Nulla Osta in person in Rome or Milan. <!-- fact_06 --> <!-- fact_17 -->\""
   }
  ],
  "fact_check_log": [
   {
    "claim": "Key takeaway 2: order certificates and apostilles early; DFAT publishes no set turnaround; Atto Notorio with four unrelated witnesses, not more than six months before",
    "status": "confirmed",
    "fact_id": "fact_24"
   },
   {
    "claim": "Melbourne books through Prenot@mi, the consulate's online booking portal; proof of address in Victoria or Tasmania",
    "status": "confirmed",
    "fact_id": "fact_10"
   },
   {
    "claim": "Living outside Australia: Embassy points to the Italian consulate in the state where you reside; Melbourne asks for VIC/TAS proof of address",
    "status": "confirmed",
    "fact_id": "fact_04"
   },
   {
    "claim": "Not published: whether an Italian consulate in another country issues the Atto Notorio to an Australian living there (no marker, correctly labelled not published)",
    "status": "confirmed"
   },
   {
    "claim": "Tribunale Civile: by appointment, two adult witnesses, interpreter if needed; neither spouse can act as witness or interpreter",
    "status": "confirmed",
    "fact_id": "fact_05"
   },
   {
    "claim": "Official Italian translation by a NAATI-certified translator, then notarisation, then apostilles on original and translation",
    "status": "confirmed",
    "fact_id": "fact_08"
   },
   {
    "claim": "Passport Office lodgement by appointment, where someone can attend on your behalf, or registered mail",
    "status": "confirmed",
    "fact_id": "fact_24"
   },
   {
    "claim": "Bagno a Ripoli does not provide an interpreter, so you bring your own",
    "status": "confirmed",
    "fact_id": "fact_31"
   },
   {
    "claim": "Timeline notes: Bagno a Ripoli 90 days' notice; harder May to September; DFAT no set turnaround; Adelaide two weeks; Brisbane one month; Rome/Milan lead times not published",
    "status": "confirmed",
    "fact_id": "fact_32"
   },
   {
    "claim": "Some steps are yours alone: both of you attend the Atto Notorio (generalised from Sydney's rule)",
    "status": "unsupported",
    "fact_id": "fact_06"
   },
   {
    "claim": "Each Australian signs the Nulla Osta in person in Rome or Milan",
    "status": "confirmed",
    "fact_id": "fact_17"
   },
   {
    "claim": "Civil wedding: both partners foreign and non-resident, Bagno a Ripoli takes a sworn declaration instead of banns",
    "status": "confirmed",
    "fact_id": "fact_30"
   },
   {
    "claim": "Marry in Australia: legal wedding at home before an authorised celebrant and two witnesses; Italy day is symbolic",
    "status": "confirmed",
    "fact_id": "fact_37"
   },
   {
    "claim": "Close: one Wedded Advisor, works in your time zone, quotes in AUD, plans venue, travel, vendors and payments",
    "status": "confirmed",
    "fact_id": "brand-facts.md"
   },
   {
    "claim": "Close: we contract and hold your suppliers; the fee is agreed in writing before any work begins; someone on the ground looks after the days that matter",
    "status": "confirmed",
    "fact_id": "brand-facts.md"
   },
   {
    "claim": "Same-sex: Italy offers civil union, not marriage",
    "status": "verify",
    "fact_id": "fact_44"
   },
   {
    "claim": "Same-sex: how Australia treats an Italian unione civile",
    "status": "verify"
   }
  ],
  "compliance": {
   "pass": false,
   "issues": [
    "No fee figures; all fee lines say 'a fee applies'. needs_signoff empty.",
    "Legal information is attributed to official sources, with 'as at October 2026' in the intro.",
    "FAIL: the 'Wedded Advisor confirms current requirements' wording is missing after the panel cut (see edits[0]).",
    "Business claims in the new close (one Advisor; time zone; AUD; plans venue, travel, vendors and payments; contract and hold; fee agreed in writing; someone on the ground) all match brand-facts.md. No unsupported claims that the Advisor books appointments, sources interpreters or attends the Prefettura.",
    "No competitor branding, no venue contact details, no statistics."
   ]
  },
  "originality": {
   "pass": true,
   "matches": [
    "italy-embassy-gov-au-marriage-in-italy-pdf.md: 7 n-grams, all from the attributed Embassy quote on Certificates of No Impediment (official source).",
    "consbrisbane-esteri-it-marriage-in-italy-for-australian.md: 1 match from a URL path."
   ]
  },
  "banned_phrases_found": [],
  "needs_signoff": []
 },
 "self_qa": {
  "checks": [
   {
    "check": "scan_copy.py run on 08-final.md and reflected",
    "pass": true,
    "note": "0 banned, 0 flagged, 0 dashes; overlaps are the attributed Embassy quote and a URL path"
   },
   {
    "check": "Every changed or new factual sentence since 05-draft-r2 logged",
    "pass": true,
    "note": "Scope is the blocking-issue check only: the r2 diff was fact-checked, and unchanged copy carries the round-1 log"
   },
   {
    "check": "Structure",
    "pass": true,
    "note": "Exactly 4 Key takeaways, each one sentence; headings the same as r2; one <!-- CTA: primary --> placeholder; 7 image slots match 04-images.json (featured, piazza, documents, civil-ceremony, symbolic-ceremony, certificate, same-sex)"
   },
   {
    "check": "Links",
    "pass": true,
    "note": "Internal: 1 hub, 4 related, 1 commercial, all in 02-seo.json and link-map.csv, none noindex, no duplicates. External: 5 official links (Embassy, Sydney consulate, Smartraveller x2, DFAT fees), all in 02-seo.json"
   },
   {
    "check": "Decision consistent with scores and blocking issues",
    "pass": true,
    "note": "Scores pass, but there are 2 blocking issues, so the decision is revise. Both fixes are exact one-sentence replacements."
   }
  ],
  "confidence": 0.9
 },
 "open_questions": [],
 "assumptions": [
  "Rubric scores were carried forward from round 1 and adjusted only for the commercial_link gain in the new close; this check covers blocking issues only, not style."
 ],
 "verify_items": [
  "Italy offers same-sex couples a civil union, not marriage (Law 76/2016, D.Lgs. 7/2017)",
  "How Australia treats an Italian unione civile"
 ],
 "tools_used": [
  "scan_copy.py",
  "validate.py",
  "jsonschema"
 ],
 "next_agent": [
  "luxury-writer"
 ]
}