{
  "agent": "icp-reader",
  "task_id": "getting-married-in-italy",
  "stage": "07",
  "status": "complete",
  "round": 2,
  "inputs_used": [
    "content-system/personas/uhnw.yaml",
    "content/posts/getting-married-in-italy/05-draft-r2.md",
    "content-system/schemas/07-icp.schema.json",
    "content-system/schemas/envelope.schema.json"
  ],
  "payload": {
    "persona_id": "uhnw",
    "first_impression": {
      "kept_reading_after_intro": true,
      "reaction": "My assistant shortlisted it, so she read it and gave me the summary. The first screen is calm and precise. No 'dream wedding' gushing and nothing about being 'affordable', so the brand doesn't lose me straight away. But it's a guide to forms. 'Getting married in Italy as an Australian takes two documents, two countries and a sequence that has to run in the right order.' Useful for whoever runs our paperwork, but it tells me nothing about whether this company can handle a wedding our size, quietly. I read the takeaways and the closing section myself and skimmed the rest."
    },
    "journey": [
      {
        "section": "Intro",
        "quote": "Most guides online are written for British or American couples and talk about a Certificate of No Impediment, which Italy will not accept from you.",
        "reaction": "Good. Precise, and it corrects something other people get wrong. That's the tone I want from anyone touching our legal side.",
        "type": "gained_trust",
        "severity": "positive"
      },
      {
        "section": "What the Atto Notorio is and where to get it",
        "quote": "Get it before you leave, from the Italian consulate for the state where you live.",
        "reaction": "We live in Dubai. Every consulate listed is in Australia. Which office covers an Australian who doesn't live in Australia? The page assumes everyone is sitting in Sydney or Melbourne.",
        "type": "confused",
        "severity": "medium"
      },
      {
        "section": "What the Nulla Osta is and who signs it",
        "quote": "Not published: how far ahead Rome and Milan release appointments, and whether a non-Australian partner attends. Your Wedded Advisor confirms both in writing before you book flights.",
        "reaction": "I like that they admit what they don't know instead of guessing. Confirming things in writing is how my family office works too.",
        "type": "gained_trust",
        "severity": "positive"
      },
      {
        "section": "Step by step once you arrive in Italy",
        "quote": "Buy a revenue stamp (marca da bollo) at a tobacconist (tabaccaio) first.",
        "reaction": "I won't be queuing at a tobacconist the week of my wedding. All of this is written as if the couple does it themselves. I want to read that someone does it for us, and whether the Rome appointment can be handled privately.",
        "type": "objection",
        "severity": "medium"
      },
      {
        "section": "Catholic wedding with civil effect",
        "quote": "A concordat marriage is celebrated by a Catholic priest and takes civil effect once transcribed in the civil register, after publications at the parish and the comune.",
        "reaction": "Publications means our names are posted publicly before the wedding. That's exactly how a date leaks. Nobody on this page says whether those notices can be kept discreet, or what that means for privacy.",
        "type": "objection",
        "severity": "high"
      },
      {
        "section": "Civil ceremony at the town hall or an approved venue",
        "quote": "Not published: which private villas your comune approves for civil ceremonies. Your Wedded Advisor confirms in writing whether your venue qualifies before you sign with it.",
        "reaction": "This is the one line that touches what I care about. Can the legal part happen at a property we've taken over completely, not in a public town hall on a piazza? It's raised and then left there.",
        "type": "confused",
        "severity": "medium"
      },
      {
        "section": "Can Australians legally get married in Italy?",
        "quote": "The comune of Bagno a Ripoli, outside Florence, states that foreign citizens may marry there whether they live in Italy or abroad, in a civil, Catholic or other religious ceremony.",
        "reaction": "'Other religious ceremony' is mentioned once and never again. After that it's only civil or Catholic. If our ceremony isn't Catholic, I don't know from this whether it counts legally.",
        "type": "confused",
        "severity": "low"
      },
      {
        "section": "Plan the paperwork with one person",
        "quote": "A Wedded Advisor works in your time zone, quotes in AUD and stays with you from the first document to the last dance.",
        "reaction": "'From the first document to the last dance' is a bit sweet for my taste, and 'quotes in AUD' tells me they're selling to standard couples. Nothing here says they've done a wedding of 300 guests with outside security.",
        "type": "lost_trust",
        "severity": "medium"
      }
    ],
    "unanswered_questions": [
      "Which office issues the Atto Notorio for an Australian citizen who lives outside Australia, for example in Dubai?",
      "Can the marriage publications at the parish and comune be kept low-profile, and who can see them?",
      "Can the legal civil ceremony be held at an exclusive-use private property rather than a public town hall?",
      "Can the Nulla Osta appointment in Rome or Milan be arranged privately, and can a representative handle the Prefettura and comune steps on our behalf?",
      "Does a non-Catholic religious ceremony have civil effect in Italy, or do we need a separate civil ceremony?",
      "Has Wedded Wonderland delivered weddings of 200 to 400 guests, with private security and VIP transfers?",
      "Is there a private or referral route to enquire, rather than a general form?"
    ],
    "turn_offs_found": [
      {
        "quote": "A Wedded Advisor works in your time zone, quotes in AUD and stays with you from the first document to the last dance.",
        "why": "Reads like a standard-client pitch. AUD quoting and a catchy line make it feel like a package service, not a private one."
      },
      {
        "quote": "Your Wedded Advisor confirms the current requirements with the comune.",
        "why": "This line, or one just like it, appears roughly ten times. Once is reassuring. By the tenth time it sounds like a template, and it's over-explaining."
      }
    ],
    "would_share_with": [
      "My assistant, to keep with the legal checklist for whichever planner we pick",
      "The family office lawyer, for the recognition section"
    ],
    "cta_reaction": {
      "quote": "Speak with a Wedded Advisor about your paperwork timeline, starting with your date and your comune.",
      "would_click": "no",
      "why": "I don't make first contact through a website button about paperwork timelines. If someone I trust referred me, or there was a discreet private line, my assistant might call. This invitation is for a couple doing it themselves, not for us."
    },
    "scores": {
      "relevance_to_me": 2,
      "trust": 3,
      "clarity": 4,
      "brand_feels_premium": 3,
      "likelihood_to_enquire": 1
    },
    "top_3_changes": [
      "Deal with privacy directly: say what the parish and comune publications make public, and whether the legal ceremony can be held at an exclusive-use private property. Where the facts aren't published, list them as questions the planner answers.",
      "Cover Australians who live abroad (Dubai, London): which office issues the Atto Notorio for them. Also say plainly that a representative can handle the Rome or Milan, Prefettura and comune steps, rather than writing as if the couple goes to the tobacconist themselves.",
      "Cut the repeated 'Your Wedded Advisor confirms' lines down to one or two, and make the close quieter: drop 'first document to the last dance' and 'quotes in AUD' and offer a discreet, private way to make contact."
    ]
  },
  "self_qa": {
    "checks": [
      {"check": "Every journey point and turn-off has an exact quote from the draft", "pass": true},
      {"check": "Stayed in character as Layla (UHNW, Dubai, scale and discretion first)", "pass": true},
      {"check": "No invented brand facts; missing information listed in unanswered_questions", "pass": true},
      {"check": "[[VERIFY]] markers and HTML comments ignored as invisible", "pass": true},
      {"check": "No invented problems; positives recorded where the draft earned them", "pass": true},
      {"check": "Payload matches 07-icp.schema.json (top_3_changes max 3, scores 1 to 5)", "pass": true}
    ],
    "confidence": 0.8
  },
  "open_questions": [],
  "assumptions": [
    "Layla or her partner holds Australian citizenship (family in Sydney); the persona card does not state nationality.",
    "The persona is provisional and not calibrated with CRM data, so weight these reactions accordingly."
  ],
  "next_agent": ["icp-panel-chair"]
}
